{
  "schemaVersion": "nus.textbook-index.v1",
  "courseId": "DSA5208",
  "source": {
    "sourceId": "DSA5208/Distributed Systems textbook pointer",
    "sourceType": "textbook",
    "page": 1,
    "role": "distributed-systems chapter pointer index",
    "status": "course-depth"
  },
  "pageCount": 4,
  "chapters": [
    { "id": "dsa5208-textbook-overview", "number": "1", "title": "Distributed-system models and evidence", "pageStart": 1, "pageEnd": 1, "sections": [{ "id": "dsa5208-t-1", "number": "1", "title": "System models, failures, and measurement", "pageStart": 1, "pageEnd": 1, "sourceRef": { "sourceId": "DSA5208/Distributed Systems textbook pointer", "sourceType": "textbook", "page": 1, "role": "chapter pointer", "status": "course-depth" } }] },
    { "id": "dsa5208-textbook-ordering", "number": "2", "title": "Causality and message ordering", "pageStart": 2, "pageEnd": 2, "sections": [{ "id": "dsa5208-t-2", "number": "2", "title": "Partial orders, FIFO, and causal delivery", "pageStart": 2, "pageEnd": 2, "sourceRef": { "sourceId": "DSA5208/Distributed Systems textbook pointer", "sourceType": "textbook", "page": 2, "role": "chapter pointer", "status": "course-depth" } }] },
    { "id": "dsa5208-textbook-clocks", "number": "3", "title": "Logical clocks", "pageStart": 3, "pageEnd": 3, "sections": [{ "id": "dsa5208-t-3", "number": "3", "title": "Lamport and vector timestamps", "pageStart": 3, "pageEnd": 3, "sourceRef": { "sourceId": "DSA5208/Distributed Systems textbook pointer", "sourceType": "textbook", "page": 3, "role": "chapter pointer", "status": "course-depth" } }] },
    { "id": "dsa5208-textbook-optimization", "number": "4", "title": "Metadata and distributed data movement", "pageStart": 4, "pageEnd": 4, "sections": [{ "id": "dsa5208-t-4", "number": "4", "title": "Timestamp compression, shuffle, and coordination", "pageStart": 4, "pageEnd": 4, "sourceRef": { "sourceId": "DSA5208/Distributed Systems textbook pointer", "sourceType": "textbook", "page": 4, "role": "chapter pointer", "status": "course-depth" } }] }
  ]
}
