{
  "schemaVersion": "nus.textbook-index.v1",
  "courseId": "DSA5104",
  "source": {
    "sourceId": "DSA5104/Database System Concepts, 7th edition",
    "sourceType": "textbook",
    "page": 1,
    "role": "course textbook chapter pointer index",
    "status": "course-depth"
  },
  "pageCount": 5,
  "chapters": [
    { "id": "dsa5104-textbook-chapter-1", "number": "1", "title": "Introduction", "pageStart": 1, "pageEnd": 1, "sections": [{ "id": "dsa5104-1-1", "number": "1", "title": "Database systems and abstraction", "pageStart": 1, "pageEnd": 1, "sourceRef": { "sourceId": "DSA5104/Database System Concepts, 7th edition", "sourceType": "textbook", "page": 1, "role": "chapter pointer", "status": "course-depth" } }] },
    { "id": "dsa5104-textbook-chapter-2", "number": "2", "title": "Introduction to the Relational Model", "pageStart": 2, "pageEnd": 2, "sections": [{ "id": "dsa5104-2-1", "number": "2", "title": "Relations, keys, and integrity", "pageStart": 2, "pageEnd": 2, "sourceRef": { "sourceId": "DSA5104/Database System Concepts, 7th edition", "sourceType": "textbook", "page": 2, "role": "chapter pointer", "status": "course-depth" } }] },
    { "id": "dsa5104-textbook-chapter-3", "number": "3", "title": "Introduction to SQL", "pageStart": 3, "pageEnd": 3, "sections": [{ "id": "dsa5104-3-1", "number": "3", "title": "Queries, joins, and aggregation", "pageStart": 3, "pageEnd": 3, "sourceRef": { "sourceId": "DSA5104/Database System Concepts, 7th edition", "sourceType": "textbook", "page": 3, "role": "chapter pointer", "status": "course-depth" } }] },
    { "id": "dsa5104-textbook-chapter-7", "number": "7", "title": "Relational Database Design", "pageStart": 4, "pageEnd": 4, "sections": [{ "id": "dsa5104-7-1", "number": "7", "title": "Functional dependencies and normalization", "pageStart": 4, "pageEnd": 4, "sourceRef": { "sourceId": "DSA5104/Database System Concepts, 7th edition", "sourceType": "textbook", "page": 4, "role": "chapter pointer", "status": "course-depth" } }] },
    { "id": "dsa5104-textbook-chapter-8", "number": "8", "title": "Object-Based and Semi-Structured Data", "pageStart": 5, "pageEnd": 5, "sections": [{ "id": "dsa5104-8-1", "number": "8", "title": "XML and JSON data models", "pageStart": 5, "pageEnd": 5, "sourceRef": { "sourceId": "DSA5104/Database System Concepts, 7th edition", "sourceType": "textbook", "page": 5, "role": "chapter pointer", "status": "course-depth" } }] }
  ],
  "distinction": {
    "lecture": "The supplied chapter1, chapter2, and chapter3 lecture decks define the current DSA5104 scope used in Atlas.",
    "textbook": "This is a copyright-safe chapter pointer index; it is textbook depth, not a replacement for lecture notes.",
    "reference": "Homework solutions are kept in the exercise source class and cited per question."
  }
}
